    {
              "$schema": "http://json-schema.org/draft-03/schema",
              "properties": {
                  "homeCity": {
                      "description": "Name of the city to which this team belongs",
                      "type": "string"
                  },
                  "id": {
                      "description": "A three-letter code that identifies the team id",
                      "maxLength": 3,
                      "minLength": 3,
                      "type": "string"
                  },
                  "name": {
                      "description": "Name of the team",
                      "type": "string"
                  },
                  "stadium": {
                      "description": "Name of the stadium",
                      "type": "string"
                  }
              },
              "type": "object",
              "name": "Team"
          }